{
    "$schema": "http://json-schema.org/draft-04/schema#",
    "type": "object",
    "properties": {
        "name": {
            "type": "string"
        },
        "views": {
            "type": "array",
            "items": {
                "type": "object",
                "properties": {
                    "value": {
                        "type": "string"
                    },
                    "name": {
                        "type": "string"
                    },
                    "published": {
                        "type": "object",
                        "properties": {
                            "public": {
                                "type": "string",
                                "pattern": "^\\d{4}-\\d{2}-\\d{2}T\\d{2}:\\d{2}$"
                            },
                            "internal": {
                                "type": "string",
                                "pattern": "^\\d{4}-\\d{2}-\\d{2}T\\d{2}:\\d{2}$"
                            }
                        },
                        "anyOf": [
                            {
                                "required": ["public"]
                            },
                            {
                                "required": ["internal"]
                            }
                        ],
                        "additionalProperties": false
                    },
                    "manualGet": {
                        "type": "boolean"
                    },
                    "aspects": {
                        "type": "array",
                        "items": {
                            "type": "object",
                            "properties": {
                                "value": {
                                    "type": "string"
                                },
                                "name": {
                                    "type": "string"
                                }
                            },
                            "required": [
                                "value"
                            ],
                            "additionalProperties": false
                        }
                    },
                    "filters": {
                        "type": "object"
                    },
                    "dimensions": {
                        "type": "object"
                    },
                    "filterGroups": {
                        "type": "object"
                    },
                    "visibleModules": {
                        "type": "object"
                    },
                    "questionGroups": {
                        "type": "object"
                    }
                },
                "required": [
                    "value",
                    "published",
                    "aspects"
                ],
                "additionalProperties": false
            }
        },
        "dimensions": {
            "type": "array",
            "items": {
                "type": "object",
                "properties": {
                    "value": {
                        "type": "string"
                    },
                    "name": {
                        "type": "string"
                    },
                    "extra": {
                        "type": "boolean"
                    }
                },
                "required": [
                    "value"
                ],
                "additionalProperties": false
            }
        },
        "filterGroups": {
            "type": "array",
            "items": {
                "type": "object",
                "properties": {
                    "value": {
                        "type": "string"
                    },
                    "name": {
                        "type": "string"
                    },
                    "tab": {
                        "type": "string"
                    },
                    "required": {
                        "type": "boolean"
                    },
                    "autoSet": {
                        "type": "boolean"
                    }
                },
                "required": [
                    "value",
                    "tab"
                ],
                "additionalProperties": false
            }
        },
        "filters": {
            "type": "array",
            "items": {
                "type": "object",
                "properties": {
                    "value": {
                        "type": "string"
                    },
                    "name": {
                        "type": "string"
                    },
                    "filterGroup": {
                        "type": "string"
                    },
                    "description": {
                        "type": "string"
                    },
                    "required": {
                        "type": "boolean"
                    },
                    "multiSelect": {
                        "type": "boolean"
                    },
                    "locked": {
                        "type": "boolean"
                    },
                    "enrichOptions": {
                        "type": "boolean"
                    },
                    "locked": {
                        "type": "object",
                        "properties": {
                            "value": {
                                "type": "string"
                            },
                            "name": {
                                "type": "string"
                            }
                        },
                        "required": ["value"],
                        "additionalProperties": false
                    },
                    "options": {
                        "type": "array",
                        "items": {
                            "type": "object",
                            "properties": {
                                "value": {
                                    "type": "string"
                                },
                                "name": {
                                    "type": "string"
                                },
                                "match": {
                                    "type": "string"
                                },
                                "selected": {
                                    "type": "boolean"
                                }
                            },
                            "anyOf": [
                                {
                                    "required": ["value", "match"]
                                },
                                {
                                    "required": ["name"]
                                }
                            ],
                            "additionalProperties": false
                        }
                    },
                    "parameter": {
                        "type": "object",
                        "properties": {
                            "field": {
                                "type": "string"
                            },
                            "type": {
                                "type": "string"
                            },
                            "eq": {
                                "type": "boolean"
                            },
                            "gte": {
                                "type": "boolean"
                            },
                            "lte": {
                                "type": "boolean"
                            }
                        },
                        "required": [
                            "field",
                            "type",
                            "eq",
                            "gte",
                            "lte"
                        ],
                        "additionalProperties": false
                    }
                },
                "required": [
                    "value"
                ],
                "oneOf": [
                    {
                        "required": ["options"]
                    },
                    {
                        "required": ["enrichOptions"]
                    },
                    {
                        "required": ["parameter"]
                    }
                ],
                "additionalProperties": false
            }
        },
        "visibleModules": {
            "type": "array",
            "items": {
                "type": "object",
                "properties": {
                    "value": {
                        "type": "string"
                    },
                    "name": {
                        "type": "string"
                    }
                },
                "required": [
                    "value"
                ],
                "additionalProperties": false
            }
        },
        "questionGroups": {
            "type": "array",
            "items": {
                "type": "object",
                "properties": {
                    "value": {
                        "type": "string"
                    },
                    "name": {
                        "type": "string"
                    },
                    "members": {
                        "type": "array",
                        "items": {
                            "type": "string"
                        }
                    }
                },
                "required": [
                    "value",
                    "members"
                ],
                "additionalProperties": false
            }
        }
    },
    "required": [
        "name",
        "views",
        "dimensions",
        "filterGroups",
        "filters",
        "visibleModules",
        "questionGroups"
    ],
    "additionalProperties": false
}